{
  "schema_version": "1.0.1",
  "receipt_id": "doc-return-001",
  "receipt_type": "RETURN",
  "fiscal_number": "FN-DEV-0001",
  "shift_id": "shift-001",
  "status": "PREPARED",
  "business_ts": "2026-03-28T11:00:00Z",
  "related_receipt_id": "doc-sell-001",
  "previous_receipt_id": "doc-sell-001",
  "goods": [
    {
      "item_id": "item-r1",
      "item_no": 1,
      "name": "Coffee",
      "price": 5000,
      "quantity": 1000,
      "sum": 5000,
      "is_return": true,
      "excise_barcodes": [],
      "discounts": []
    }
  ],
  "payments": [
    {
      "payment_id": "pay-r1",
      "payment_type": "CASH",
      "amount": 5000
    }
  ],
  "totals": {
    "total_sum": 5000,
    "round_sum": 0,
    "discounts_sum": 0,
    "extra_charge_sum": 0
  }
}
